ASIN,Dimensions,activeseller,bestseller,brand,buybox,description,firstdate,img,price,rating,reviews,title,url,weight_lbs
B088FP39M6,n/a,0,"#13,591 in Office Products #48 in Managerial Chairs & Executive Chairs",Myka's,Myka's,"Premium ergonomic leather executive office chair, soft PU leather with thick padding for the back support and seat provides plush cushioning and optimal firmness for exceptional support and comfort .Ergonomic body-hugging high back and unique color-matching design; Perfect handcrafted.Flip-up armrest; Nylon Large five-star base for extra safety and durability; Class-3 gas cylinder.Easy assembling, Only 12 pecs screws needed to fix; Swivel, movable,Reclining and height adjustable.Warranted against manufacturing defects in material and workmanship for two years from the original date of purchase with the following exceptions: Upholstery materials,foam,gas cylinders,wood components,control mechanism and electronic components. The base, armrest and castors etc should be replaced against the clear presentation of broken part.",5-Sep-17,https://m.media-amazon.com/images/I/61zaZ5v11ZL._AC_UL320_.jpg,129.99,4.4,329,Myka's Ergonomic Leather Executive Office Chair High Back Computer Desk Chair with Upholstered Armrest (Pink),https://www.amazon.com/Mykas-Ergonomic-Executive-Computer-Upholstered/dp/B088FP39M6/ref=sr_1_120?dchild=1&keywords=chair&qid=1614191846&sr=8-120,0
B08CN1BT7S,18.5 x 17.91 x 8.26,0,"#40,221 in Home & Kitchen #142 in Home Office Desk Chairs",Hbada Store,Hbada Direct,"Black and White - Classic design,black and white simple color matching low-back desk chair. Perfect for different decorative stylesPracticality - Whether you are working, studying or serving, you can use it in various scenarios as you wish.Ergonomic - Chair backrest fit the natural curve of the human body, release the pressure of your spine.Thickened cushions provide better sitting experience.Good Quality - 360swivel to get the maximum usage of your workspace and casters running smoothly on the floor. 250 lbs of max Capacity and provide great stability.Service - We offer a 1 year warranty for all our customers. If youre have any questions about this chair, please contact us via buyer message.",9-Jul-20,https://m.media-amazon.com/images/I/61m8GMJbEZL._AC_UL320_.jpg,69.99,4.7,140,"Hbada Office Chair, Mesh Desk Task Chair, Ergonomic Computer Chair with Adjustable Height for Adults and Kids,White ",https://www.amazon.com/gp/slredirect/picassoRedirect.html/ref=pa_sp_atf_next_aps_sr_pg4_1?ie=UTF8&adId=A03759042FJBPNDGQTVT&url=%2FHbada-Office-Ergonomic-Computer-Adjustable%2Fdp%2FB08CN1BT7S%2Fref%3Dsr_1_146_sspa%3Fdchild%3D1%26keywords%3Dchair%26qid%3D1614191849%26sr%3D8-146-spons%26psc%3D1&qualifier=1614191853&id=746465114169316&widgetName=sp_atf_next,19.96
B07HSW27GD,25.6 x 25.2 x 43.5,2,"#97,881 in Home & Kitchen #282 in Home Office Desk Chairs",CLATINA Store,CLATINA Office Supply,"ERGONOMIC DESIGN: If you have always wanted to feel comfortable when working on the computer or talking on the phone, this office chair will offer you the possibility to adjust it according to your preferences. Its body curved backrest with lumbar support will help you improve your posture and relieve the awful back pain caused by sedentary sitting.BREATHABLE MATERIAL: The Office Chair comes with a backrest covered with breathable mesh that provides good ventilation and a wonderful sitting experience. Plus, the high density fabric covering the sitting surface will help you enjoy a soft sensation and prevent bottom pain.STURDY AND SUPPORTIVE: Forget about contracted muscles and back pain! Our chair is sturdy and supportive enough to deliver optimal comfort throughout a busy day. The backrest is adjustable and body curved providing excellent lumbar support and improving your posture.HEIGHT ADJUSTEMENT: Thanks to the lifting regulation feature, you can increase the height of the chair with 10 more cm, which makes it suitable even for tall people. And if you want to rest or increase the height of the armrests you can also adjust them according to your needs. Our product will help you transform your daily sitting routine into a delightful experience!SYNCHRONIZED MOVEMENT: This office chair allows you to make a 360 degree rotation so that you can benefit from extra mobility. The smooth running castors will take you fast and easy to any part of your office without making any effort. Why consuming your energy when you can enjoy the amazing swiveling advantages of this product?",6-Aug-19,https://m.media-amazon.com/images/I/71gCHK6KrXL._AC_UL320_.jpg,109.99,4.3,275,CLATINA Ergonomic High Mesh Swivel Desk Chair with Adjustable Height Arm Rest Lumbar Support and Upholstered Back for Home Office,https://www.amazon.com/gp/slredirect/picassoRedirect.html/ref=pa_sp_atf_next_aps_sr_pg4_1?ie=UTF8&adId=A027695130P4YVJAAF48H&url=%2FCLATINA-Ergonomic-Adjustable-Support-Upholstered%2Fdp%2FB07HSW27GD%2Fref%3Dsr_1_148_sspa%3Fdchild%3D1%26keywords%3Dchair%26qid%3D1614191849%26sr%3D8-148-spons%26psc%3D1%26smid%3DA3KJUR99JGR6ZG&qualifier=1614191853&id=746465114169316&widgetName=sp_atf_next,50
B07H9YLLNG,27.8 x 27.8 x 43.3,2,"#9,399 in Office Products #27 in Managerial Chairs & Executive Chairs",CLATINA Store,CLATINA Office Supply,"FULLY ADJUSTMENT DESIGN: you can adjust the seat height and depth, the armrest height and angle, the lumbar support height, the backrest tilt angles and tilt tension. All these designs aim to help you find a comfortable sitting position just for you.RELIABLE COMFORT: this super comfortable office chair features breathable back that allows airflow to keep your back cool. Besides, the updated thick pad with soft texture can obviously decline the pressure of the sedentary.ENHANCED FRAME: featuring reliable ergonomic support, this 360 degree swivel chair seat back reclines from 90 up to 135 degrees. Its gas lift has been tested and the solid construction can support up to 275 lbs.EASY TO INSTALL: simple instructions enable anyone to put this executive chair together in FIVE simple steps! Once chair is mounted, youll be able to adjust the chair to fit your individual needs.5-YEAR WARRANTY: Your 100% satisfaction is our #1 priority. We offer a 60-month warranty and free replace or return sevice within 90 days. Feel free to contact our CS if you have any qustions.",13-Sep-18,https://m.media-amazon.com/images/I/61VcZblJKuL._AC_UL320_.jpg,199.99,4.4,180,CLATINA Ergonomic High Swivel Executive Chair with Adjustable Height 3D Arm Rest Lumbar Support and Upholstered Back for Home Office Black New Version,https://www.amazon.com/gp/slredirect/picassoRedirect.html/ref=pa_sp_atf_next_aps_sr_pg4_1?ie=UTF8&adId=A01365371M3RRWL2S1IOG&url=%2FCLATINA-Ergonomic-Executive-Adjustable-Upholstered%2Fdp%2FB07H9YLLNG%2Fref%3Dsr_1_147_sspa%3Fdchild%3D1%26keywords%3Dchair%26qid%3D1614191849%26sr%3D8-147-spons%26psc%3D1%26smid%3DA3KJUR99JGR6ZG&qualifier=1614191853&id=746465114169316&widgetName=sp_atf_next,47.3
B08RSNLKHG,35.2 x 20.1 x 7.3,0,"#20,353 in Home & Kitchen #15 in Kids' Table & Chair Sets",Milliard Store,Home Wise,"Multi Activity Table: Tabletop surface is made of Double Sided Playboard. The Lego side provides the perfect play space for building fun construction playtime. Flip it over to use the smooth surface table for creative projects and tea parties. Play with the city action road map surface for hours of fun and adventure. This table and chair set provides the perfect play space for the ultimate fun!Convenient Storage: use the 3 built in storage shelves to store your building blocks, rings, and other shiny things neatly in the included sectional baskets, straight on the shelves or in the seat baskets.Built to Last: Sturdy composite wood adorns this table set with a two-tone scratch-resistant finish in white and grey for a premium fit and feel that easily fits the dcor of any room and any gender.Safety First: Lab tested and kid approved. Both the table and chairs have been strength and safety tested by an independent consumer agency, because theres nothing fashionable about accidents!Dimensions: The tabletop is 31.5 x 16"" and the table height is 18.5"". The chairs are 11.5"" wide, 10.5"" deep and 22.5"" high. Assembly time avg. 30 min, tools included. Made with high quality materials for years of fun spanning generations.",31-Dec-20,https://m.media-amazon.com/images/I/61KyXkj3GeL._AC_UL320_.jpg,144.99,4.5,36,"Milliard Kids 3-in-1 Play Table and Chair Set Wood with Storage Baskets, Compatible with Lego and Duplo Bricks, Activity Table Playset Furniture with Modern Gray Colors",https://www.amazon.com/Milliard-Storage-Compatible-Activity-Furniture/dp/B08RSNLKHG/ref=sr_1_119?dchild=1&keywords=chair&qid=1614191846&sr=8-119,54
B015ETINHS,22 x 25 x 31,7,"#88,801 in Home & Kitchen #111 in Living Room Chairs",Armen Living Store,Amazon Warehouse,"100% PolysterMid-century Modern and Contemporary but can blend into any design providing an inviting centerpiece for your guestsGreat for Kitchen, Dining, Home Office space,Commercial Setting or any living space in your homeBucket Seat design offers exceptional support and comfortSolid walnut wood finish for durability and longevityMedium high cushioned open back to help keep your back supported and alignedConvenient arm rest for optimal comfort",n/a,https://m.media-amazon.com/images/I/81zK2O96htL._AC_UL320_.jpg,125.61,4.5,1231,Armen Living Summer Chair in Charcoal Fabric and Walnut Wood Finish,https://www.amazon.com/Armen-Living-LCSUCHWACH-Summer-Charcoal/dp/B015ETINHS/ref=sr_1_121?dchild=1&keywords=chair&qid=1614191846&sr=8-121,15
B01MYTP3IZ,26.76 x 3.13 x 31.09,5,"#21,234 in Home & Kitchen #7 in Folding Chairs",Tommy Bahama Store,Amazon.com,"TRAVEL HANDS-FREE: The Tommy Bahama Big Boy backpack chair offers hands-free portability and it's lightweight aluminum frame makes it easy to carryUNIQUE AND FUNCTIONAL: Adjustable padded backpack shoulder straps with large storage pouchEXTRA ROOM: Higher than the standard 8"" seat height, the chair sits 13"" off the ground and has an extra wide 22"" seat widthPINCH-FREE SEAT ADJUSTMENTS: 4-position easy-adjust recline options allows you to adjust without the worry of getting your fingers or hands caught in the bracketsDURABLE AND LIGHTWEIGHT: Beach chair frame is constructed of durable rust-proof aluminum, making it lightweight and easy to carry and weighs only 11 lbs.",n/a,https://m.media-amazon.com/images/I/71kVuK1EkBL._AC_UL320_.jpg,59.99,4.7,496,"Tommy Bahama Big Boy 4-Position Folding 13"" High Seat Backpack Beach or Camping Chair, Navy",https://www.amazon.com/Tommy-Bahama-Backpack-Chair-Navy/dp/B01MYTP3IZ/ref=sr_1_118?dchild=1&keywords=chair&qid=1614191846&sr=8-118,10.23
B08TTV4CGP,21.6 x 20.4 x 58.2,2,"#50,772 in Home & Kitchen #72 in Video Game Chairs",ANBEGE Store,ANBEGE US,"ALL FOR GAMING: ANBEGE is dedicated to promote your gaming experience! The unique Back Logo Design can make your gaming area more modern elegant. It also can used for working and studying. Dimensions: 21.6""(L) x 20.4""(W) x 54.3""-58.2""(H); Sitting Area Dimensions: 16''(L) x 19.68''(W); Maximum Weight Capacity: 300 pounds.QUALITY MATERIAL: High-quality breathable leather surface (skin-friendly & clean easily), high density shaping foam (high resilience and more comfortable), strong steel frame (ergonomic design to fit your back), the class-3 gas lift (durable & flexible), nylon smooth-rolling casters, Mute PU wheel (protect the wooden floors from being scratched), all of these make the it possible to be used for a long time.MULTI-FUNCTION: This Video gaming chair has enjoyable rocking function, 90 to 165 reclining; 360 swivel; 18.2""-21.3 seat-height adjustment; Removable headrest pillow and lumbar Cushion. Everything for building an ideal seat.ERGONOMIC DESIGN: ANBEGE ergonomic construction design gaming chair with freely adjustable lumbar support and headrest pillow make you feel comfortable and relax after long-time gaming or working, it can protect your spinal &neck.QUALITY ASSURANCE: Excellent after sales Service Free replacement or money back for any reason within 30 days. Free replacement for damaged or defective parts within 12 months. Any dissatisfaction with our products or service, please contact us to solve. Customer satisfaction is our top priority. If you have any problems ,pls contact ANBEGE!, Our customer service team is always here for you!",5-Aug-20,https://m.media-amazon.com/images/I/61t4uaLm1oL._AC_UL320_.jpg,169.99,4.6,115,ANBEGE Gaming Chair Racing Style Office Chair Height Adjustment Leather High Back Ergonomic Backrest Computer Game Chair with Headrest and Lumbar Pillow Support Swivel Desk Chair (Blue),https://www.amazon.com/ANBEGE-Adjustment-Ergonomic-Backrest-Computer/dp/B08TTV4CGP/ref=sr_1_117?dchild=1&keywords=chair&qid=1614191846&sr=8-117,42
B08FD2SBLZ,n/a,0,"#24,212 in Home & Kitchen #16 in Computer Gaming Chairs",WeGuard,WeGuard,"PREMIUM QUALITYClass 4 explosion-proof gas spring of international standard BIFMA and SGS, high-quality and durable PU leather. The steel frame with a thickness of 1.5mm is a sturdy integrated metal frame, corrosion-resistant, stain-resistant, waterproof, faded and scratched, and can support 300 pounds!IMPROVED COMFORTInnovative implantable USB electric massager makes the lumbar cushion softer. The thickened cushion and widened backrest can improve the comfort of the chair. Height-adjustable 2D adjustable polyurethane armrest. Effectively relieve fatigue from intense gaming sessions or long hours of work.MULTI-FUNCTIONAL 180 adjustable backrest, Working/Gaming/Watching/Resting. 180 degree reclining office chair, retractable footstool, 360 degree smooth rotating racing wheel, Height-adjustable gas spring cylinder, Movable headrest and massage lumbar cushion. You can enjoy yourselfEASY TO ASSEMBLY We provide all the necessary installation tools, and all the hardware is equipped with blister to avoid collision. We also provide instructions, which can be easily installed within 15 minutes.NO RISK PURCHASE100% free replacement for non-human factors within 365 days. If you find any problems during the use, please contact us as soon as possible, we will provide you with a satisfactory solution.",7-Aug-20,https://m.media-amazon.com/images/I/61uc6A5fcvL._AC_UL320_.jpg,149.99,4.4,237,WeGuard Massage Gaming Chair Racing Office Computer Game Chair Swivel Ergonomic Executive PU Leather Chair with Adjustable Headrest and Lumbar and Support Retractable Footrest (Black),https://www.amazon.com/WeGuard-Ergonomic-Executive-Adjustable-Retractable/dp/B08FD2SBLZ/ref=sr_1_114?dchild=1&keywords=chair&qid=1614191846&sr=8-114,0
B0854CWDHY,27.7 x 18.8 x 7.9,6,"#16,374 in Home & Kitchen #2 in Office Kneeling Chairs#61 in Home Office Desk Chairs",VIVOHOME Store,VIVOHOME,"RUGGED CONSTRUCTION - Constructed with heavy-duty iron frame, its surface is sprayed with anti-oxidation treatment to prevent rust and wear; Comes with sturdy and polished metal fittings for each connection, which has strong corrosion resistance, increasing the firmness of the product, and extending the service life, up to 330 lbs powerful loading capacityERGONOMIC DESIGN - Made from durable PU leather, thick foam, strong metal; This kneeling chair at a comfortable angle to keep your back upright, distribute the pressure between the buttock and legs; You can use this chair with full confidence to greatly relieve issues with your neck, back, and vertebra and enjoy your workdayCOMFORTABLE 4 INCH CUSHIONS - Compared with other kneeling chairs, the cushions of VIVOHOME Kneeling Chair have been thickened to 4 inches and featured a memory function, which provides much more comfortable support for your buttocks and knees; Its a great and cool item for helping to work productively for longer periodsADJUSTABLE HEIGHT - VIVOHOME kneeling chair features a manual adjustment for the height of both the seat and the knee cushion to firmly secure them in place and give the necessary support; The seat adjusts from 21 to 28 tall to achieve the ideal fit for majority desk4 REMOVABLE CASTERS - Equipped with 4 removable rolling wheels so it can easily be maneuvered throughout your home or office; 2 of 4 rolling wheels are lockable, which keep the chair more stable as your safe defender and give you a stable working condition",24-Feb-20,https://m.media-amazon.com/images/I/91UL8+biFnL._AC_UL320_.jpg,109.99,4.1,377,VIVOHOME Ergonomic Kneeling Chair Adjustable Stool with Thick Foam Cushions and Smooth Gliding Casters for Home Office Black,https://www.amazon.com/VIVOHOME-Ergonomic-Kneeling-Adjustable-Cushions/dp/B0854CWDHY/ref=sr_1_115?dchild=1&keywords=chair&qid=1614191846&sr=8-115,19.41
B07V6Z97QJ,29.13 x 25.2 x 43.11,6,"#23,382 in Home & Kitchen #86 in Home Office Desk Chairs",Amazon Basics Store,Amazon.com,"Padded executive office chair with extra-wide seat cushion and 275-pound weight capacityContoured, segmented seat design provides plush comfort and support throughout the work daySmooth, supple LeatherSoft polyurethane upholstery offers a modern lookAdjustable pneumatic height lever and tilt mechanism with infinite locking adjustmentSturdy 5-point base for extra stabilityRolling caster wheels and 360-degree swivel mobility",19-Nov-19,https://m.media-amazon.com/images/I/715wPeALa1L._AC_UL320_.jpg,153.24,4.6,654,"Amazon Basics Modern Executive Chair, 275lb Capacity with Oversized Seat Cushion, Ivory Bonded Leather",https://www.amazon.com/AmazonBasics-LeatherSoft-Executive-Capacity-Oversized/dp/B07V6Z97QJ/ref=sr_1_116?dchild=1&keywords=chair&qid=1614191846&sr=8-116,37.3
B07YXM7X74,33.1 x 25.6 x 12.6,0,"#11,687 in Home & Kitchen #11 in Computer Gaming Chairs#24 in Video Game Chairs",Royaledirect,Lemberi,"*Ergonomic Design for Multi-occasionThe ergonomic body-hugging high back provides lumbar support and naturally fits your shoulders, head and neck. The orthopedically friendly design includes a tilt locking mechanism with up to 90-155 degree angles of adjustment. That means you can tilt back and lock for resting or relaxing, or even lay the chair flat if you need a quick nap.*Selected Material Skin friendly and wear-resisting PU leather for years of use, high quality filler bring better feels, Class 3 gas lift verified by SGS, durable,reliable and supports*Easy to Set Up Follow the gaming chair instruction, and you will find it easy to install. It will cost you about 10-15mins to assemble the racing chair, which supports up to 300 pounds.*Multi-Function360 Degree Swivel and omni-directional Wheels. 90 - 155 degree adjustable backrest. Height-adjustable gas spring cylinder. All of these practical mechanisms are very easy to control and adjust.*Excellent After-Sales Service Free replacement or parts guarantee for any quality problem within 90 days, Satisfaction guaranteed.",7-Jan-20,https://m.media-amazon.com/images/I/71+2EOFmywL._AC_UL320_.jpg,109.99,4.3,926,"Gaming Chair Racing Style Office Ergonomic Chair High-Back PU Leather Design PC Computer Gaming Chair Adjustable Height Swivel Chair with Footrest, Headrest and Lumbar Support (Red)",https://www.amazon.com/Ergonomic-High-Back-Computer-Adjustable-Footrest/dp/B07YXM7X74/ref=sr_1_113?dchild=1&keywords=chair&qid=1614191846&sr=8-113,45.9
B07TVYFQKQ,22 x 28 x 33,0,"#244,959 in Home & Kitchen #422 in Living Room Chairs",Ball &amp; Cast,Amazon.com,"Wooden frame and Tufted upholstery in Blue fabric;Cushioned Seat comfortably padded with high-density foam;Durable wood legs in Espresso Finish;Simple assembly required; instructions, hardware and tools included;Overall size: 22""W x28dx 33""h.Material Type: Wood Foam TextileIncluded Components: Seat Backrest Leg HardwareFinish Types: Lacquer",2-Jan-20,https://m.media-amazon.com/images/I/81gzO3fjYZL._AC_UL320_.jpg,149.99,4.4,39,"Ball &amp; Cast Accent Chair , Blue",https://www.amazon.com/Ball-Cast-Accent-Chair-HSA-6008/dp/B07TVYFQKQ/ref=sr_1_112?dchild=1&keywords=chair&qid=1614191846&sr=8-112,24.5
B081TQZRX1,28.5 x 31.5 x 46.5,0,"#74,256 in Home & Kitchen #225 in Home Office Desk Chairs",Dkeli,Dkeli,"Big and Tall Office Chair for EveryoneOur big and tall office chair with ergonomic design gives you maximum support for comfort and convenience. The executive chair has soft padding and headrest for less pressure on the back of your legs so you can stay comfortable even when you have to sit down for hours. Our adjustable Executive chair can supports up to 500lbs and all of people. The ergonomic desk chair is the best gift for people who are sitting in the office for a long time.Sturdy & High Quality MaterialOur big and tall office chair has a heavy duty Metal base and nylon rolling casters that great stability and mobility. And the executive chair with soft PU leather upholstery and unique appearance, strong wear resistance, high elasticity, good hand feel to bring you incomparable enjoyment experience. Office chair executive chair computer desk chair big and tall office chairSmooth Tilt and SwivelYou can pull out on the control handle, which allows yours to tilt back sit forward. the big and tall office chair can be reclined from 90 degrees to 120 degrees so that you can find the optimal position to work or rest. And our executive chair can be rotated 360 degrees, with sturdy rolling wheels, it can move easily, and it will not make noise, the computer desk chair is the best helper in your office. big and tall office chair executive chair Ergonomic desk chairAdjustable Height & Comfortable ArmrestOur Big and tall office chair with extra thickness gas lift, fast up and down, pass the BIFMA and SGS, you can adjust the seat high from 20-23. The office chair arms have a ergonomic design with extra thickness PU padded armrest, it is can maximizes the comfort of the neck, back, spine and back. Good for blood circulation and maximize your work efficiency. Ergonomic office chair big and tall desk chair executive chair high back office chairEasy to Set UpWith the installation instruction,the computer desk chair can be assembled in just a few steps within 15 minutes. And all parts of the executive chair are given a number and detailed assembly steps are listed for your reference. And our Ergonomic office chair packed very well, if you have any problem with the executive chair, please contact with us. Office chair heavy duty desk chair ergonomic executive chair tall",21-Nov-19,https://m.media-amazon.com/images/I/71qFylcWQEL._AC_UL320_.jpg,189.99,4.2,203,"Big &amp; Tall Executive Office Chair Heavy Duty 500LBS Computer Desk Chair Ergonomic High Back Task Rolling Swivel Chair with Lumbar Support Armrest PU Leather Classic Black Executive Chair for Man, Wome",https://www.amazon.com/Big-Tall-Executive-Office-Chair/dp/B081TQZRX1/ref=sr_1_110?dchild=1&keywords=chair&qid=1614191846&sr=8-110,49.5
B08VF9VKL3,27.1 x 29.3 x 52.4,2,"#43,828 in Home & Kitchen #152 in Home Office Desk Chairs",BestOffice Store,Amazon.com,"COMFORTABLE THICKNESS: NOT PRONE TO DEFORMATION - Office chair have excellent breathable design of seniorimports ofpreventingloosingmesh, maintain the air flowing naturally in the desk chair seat area keep the sweat and back were not overheating. Big and tall office chair have heavy-duty metal base with 360-degree swivel and nylon smooth-rolling casters, great stability and mobility. BEST FOR BIG AND TALL - This big and tall office chair with a unique appearance, and extra thickly cushioned desk chair for your maximum comfort. Computer chair have commercial-grade components, all pass BIFMA, and soft sponge with flexible spring, supports up to 400lbs.SUPER EASY TO SET UP - Desk chair comes with all hardware & necessary tools. Follow the computer chair instructions, you'll found easy to put together, and big and tall office chair estimated assembly time in about 10-25mins.ADJUSTABLE BACK SUPPORT & ARMREST - Big & Tall office chair features fully adjustable settings with adjustable position PU padded armrest, the height of the lumbar also adjust.And, big tall chair have waist support to adjust the comfort of chair! Good lumbar support to help reduce back pressure and relax the natural curve of the spine, choose according to what you need.WE ASSURED - We guarantee you will love this desk chair which is cheap but good material. But if youre not satisfied with this computer chair, please get in touch with us, best service for you!",30-Jan-21,https://m.media-amazon.com/images/I/71QXIg7y0RL._AC_UL320_.jpg,159.99,3.4,4,Big and Tall Office Chair 400lbs Wide Seat Executive Desk Chair with Lumbar Support Adjustable Armrest Ergonomic Headrest High Back Mesh Computer Chair Rolling Swivel Task Chair(Black),https://www.amazon.com/Big-Tall-Office-Chair-Adjustable/dp/B08VF9VKL3/ref=sr_1_111?dchild=1&keywords=chair&qid=1614191846&sr=8-111,39.8
