ASIN,Dimensions,activeseller,bestseller,brand,buybox,description,firstdate,img,price,rating,reviews,title,url,weight_lbs
B088ZSLSTZ,22.44 x 20 x 35,0,"#64,444 in Home & Kitchen #38 in Kitchen & Dining Room Chairs",GreenForest Store,GreenWorlds,"Waterproof and Anti-Dirty PU faux Leather Dining Chairs Set of 2 : Adopt the high quality brown PU leather covered on the chair seat & back, the waterproof feature allows the dining chairs easy to clean the dirty with a damp cloth. Effectively reduce your regular maintenance work.Mid Century Modern Dining Chairs Set of 2 :GreenForest is striking to develop the up-to date furniture to meet various customers taste. The brown pu leather dining chairs are one of our choices. The sleek and simple shell design, brings the modern style to your home or apartment, make it a perfect decor for your kitchen and living room.One Step to Complete Assembly: With assembled metal legs, only screw the dining chair legs in seat to complete whole set-up , it only takes less than 15 mins from opening the package to finish the 2 chairs assembly . This PU faux leather diining chairs are sturdy enough for children and adults ,having a max loading capacity: 250LBS .Upholstered Dining Chairs Set of 2 :Soft sponge padding seat with highly ergonomics curved design and mid back, which reduce your back pressure and provide optimum comfort while sitting. Rubber leg pads protect floors from dents and scratches, wont cause much noise during your dinner time.Customized Your Dining Chairs: Change the dining chair's leg color by painting the wood finish to any color you like: bronze, black or gold. Good size :17.3""x15.9""34.6""(LxWxH) and light weight allow the dining chairs easy to move around if you need. The cats and dog are not suggested to sit and sleep on the chairs.",21-May-20,https://m.media-amazon.com/images/I/61vAz3OOHsL._AC_UL320_.jpg,139.99,4.7,156,"GreenForest Dining Chairs Set of 2, Vintage PU Leather Upholstered Side Chairs, Mid Century Modern Kitchen Room Chairs,with Metal Legs,Camel Brown",https://www.amazon.com/GreenForest-Leather-Upholstered-Century-Kitchen/dp/B088ZSLSTZ/ref=sr_1_246?dchild=1&keywords=chair&qid=1614191856&sr=8-246,22.8
B08L22X2TX,10.04 x 8.66 x 16.93,2,"#37,355 in Home & Kitchen #7 in Kids' Desk Chairs",BITMEE,Delicate Shop,"Ergonomic Design : Constructed with a curved backrest to makes the child sit more comfortable, It is also helpful for kids to sit correctly from an early age. The chair legs are triangular in shape to help reduce tipping and increase safety. Reliable Quality : BITMEE Toddler chairs for girls and boys assured that all are made with the eco-friendly durable non-toxic plastic, which are safe and reliable for your kids.The hard material can bear over 350pouns(factory tested), so you dont need to worry about your child falling down due to the quality of the chair. Easy to Install & Carry : The table legs can be easily removed and installed in less than a minute even children can do it by themselves, It is helpful to develop children's hands-on ability (after finished please help them check the connection point). Each of BITMEE Chairs comes with a cute storage bag for kids. When the chair is taken apart, it is easy to carry and store, so that the children can better enjoy the outdoor time! Easy to Clean & Multi-scene use : You can wipe it with a dry cloth or a damp cloth also it can be washed with water and will not fade. For families, classrooms, daycare, kindergarten or children's rooms. Perfect for toddlers ages 2 and up. An essential partner for growth WHAT YOU GET  1 x BITMEE Toddler Chair, 1 x Cute Storage Bag,Chair dimensions: 10.35""W x 10.12""D x 17.01""H. Chair seat height: 9.65"". If you have any quESTIONES, just contact us any time we will solve them in time!",26-Oct-20,https://m.media-amazon.com/images/I/51dhmycPppL._AC_UL320_.jpg,22.19,4.3,77,"BITMEE Kids Chair, Toddler Chair, Toddler Chairs for Boys and Girls, Ergonomic Design, Eco-Friendly Durable Plastic, Indoor or Outdoor Use Kids Chairs for Boys and Girls- Barbie Pink",https://www.amazon.com/BITMEE-Toddler-Ergonomic-Eco-Friendly-Durable/dp/B08L22X2TX/ref=sr_1_245?dchild=1&keywords=chair&qid=1614191856&sr=8-245,1.96
B08KZKHQ2B,28 x 27 x 50,0,"#58,632 in Office Products #185 in Managerial Chairs & Executive Chairs",Kasorix,n/a,"GREAT COMFORT and RELAXATION Ergonomic design for long-lasting comfort.S shap thick padded backrest and 6.3"" thick high density foam paded cushion,give your lumbar great support,alleviate the back pain that can result from long working hours,90-135 degrees tilt angle,tilt-teshion lock by wire control,a tilt-tension knob makes it easier or harder to rock back in your chair and easily lying down to have a nap,360 degrees swivel,height adjustable,flexible to adjust your favorate position.EASY TO INSTALL Package with tools,hardware and instruction inside,easily install our product,estimated assembly time within 20 mins by following the instruction,also requires low maintenance,widely apply to workplaces like home, office, conference room and reception rooms.PREMIUM QUALITY Heavy duty metal chair base,3 class gaslift,pass the BIFMA test make the chair in great stability and mobility,withstand up to 440 lbs,excellent breathable PU Leather,more wear-resisting and anti-oxidation for big and tall,noiseless rollers.UPSCALE APPREARANCE Product size: Size of Back: 20.9""X30.3""(LXW),Size of Seat: 20""X21.7""(LXW),Seat adjustable height:19.3-22 inch. Sleek modern design ,luxury enjoyment.WARRANTY POLICY We are committed to doing every process well from design to completeness for our customer's satisfaction. If there is any question, please let us know directly, we will deal with it immediately.",7-Jul-20,https://m.media-amazon.com/images/I/81WREYmb6zL._AC_UL320_.jpg,0,4.5,14,"Kasorix Big and Tall Executive Office Chair with Footrest,Desk Chairs with Lumbar Support,Ergonomic Adjustable Bonded PU Leather Rolling Chair(Black-9095)",https://www.amazon.com/Kasorix-Executive-Ergonomic-Adjustable-Black-9095/dp/B08KZKHQ2B/ref=sr_1_235?dchild=1&keywords=chair&qid=1614191853&sr=8-235,50.9
B081ZWJHW4,n/a,13,"#54,932 in Home & Kitchen  #53 in Living Room Chairs",Mainstay,Premium Deals.,MicrosuedeImportedSoft seat with microsuede fabricCollapsible for easy storageMaximum weight capacity: 225 lbs,5-Oct-19,https://m.media-amazon.com/images/I/91o+SvPM0xL._AC_UL320_.jpg,42,5,3,Mainstay Butterfly Chair in Teal Faux Fur Finish,https://www.amazon.com/Mainstay-Butterfly-Chair-Grey-Finish/dp/B081ZWJHW4/ref=sr_1_237?dchild=1&keywords=chair&qid=1614191853&sr=8-237,0
B08N4WMCBR,20 x 20 x 39,0,"#67,985 in Home & Kitchen #212 in Home Office Desk Chairs",OFIKA,PUKAMI,"Upgrade For Your Maximized Comfort- According to the upgrade ergonomic supporting cervical vertebrae design, our desk chair can fit perfectly on your back and reduce back pain caused by long time sitting. The executive office chair mesh at the back allows for enough breathability during working, and the wider thicker seat pad is a great idea for long-lasting comfort in your office or home!Heavy Duty For Long-term Use - With durable nylon base, our ergonomic office chair is a reliable and sturdy option for users weighing up to 250 lbs. We have performed nearly 1,000 quality checks before shipment and assure you a 100% SATISFACTION GUARANTEE once our mesh office chair does not live up to your expectations.Adjustable Height And Armrest-3.94 inches height adjustable and 360 rolling wheels on our home office chair are flexible and suitable for your office environment. The tilt function with position lock and 120 back adjustment are ready for your office rest, perfect for bedrooms, office and kids desk!Easy to Set up- Comes with all hardware & necessary tools, this computer desk chair is easy and quickly to assemble according to the instructions on the package, only 10-15 minutes required to complete the entire installation process.Money Back Guarantee - We always strive to give you the best quality modern desk chair for pain relief and also pay more attention to your feelings. If there is any problem with the office chair in 30 days, please contact us directly for a free replacement or full refund. Free parts replacements for Installation problem, Damaged or Missing parts within 1 year!",11-Nov-20,https://m.media-amazon.com/images/I/71xhGnxzzRL._AC_UL320_.jpg,54.99,4.4,247,"OFIKA Office Chair Ergonomic Desk Chair, Adjustable Task Chair for Lumbar Back Support, Mesh Mid Back Computer Chair with Rolling Swivel and Armrest, Modern Executive Home Office Desk Chairs (Grey)",https://www.amazon.com/Ergonomic-Adjustable-Support-Computer-Executive/dp/B08N4WMCBR/ref=sr_1_232?dchild=1&keywords=chair&qid=1614191853&sr=8-232,23
B0019QKK5Y,22 x 22 x 33.5,20,"#64,281 in Home & Kitchen #198 in Home Office Desk Chairs",Boss Office Products Store,Amazon.com,One touch adjustment instantaneously raises or lowers chair5 star nylon base allows smooth movementDurable plastic protects seat back and bottom from tearsUpholstered in Black CrepeWeight capacity is 150 lbs.Ships ready to assemble,2-Oct-01,https://m.media-amazon.com/images/I/71KxJpW3mcL._AC_UL320_.jpg,47.37,4.5,844,Boss Office Products Fabric Steno Chair in Black,https://www.amazon.com/Boss-Office-Products-B205-BK-Fabric/dp/B0019QKK5Y/ref=sr_1_236?dchild=1&keywords=chair&qid=1614191853&sr=8-236,15.22
B07JQDF12D,22.83 x 20.47 x 23.23,6,#518 in Home & Kitchen #1 in Kids' Desk & Chair Sets#1 in Kids' Desk Chairs,Delta Children Store,Amazon.com,"AGE RANGE: Recommended for ages 3+TONS OF STORAGE: This Chair Desk features a removable cup holder for art supplies and fabric storage bin under the seat for books, toys or additional art suppliesEXTREMELY SAFE: We know chemicals have no place in your kid's space, so we use a non-toxic multi-step painting process that is lead and phthalate safeDURABLE: Scratch-resistant finish protects the colorful graphics | Made of engineered wood and fabric | Wipe clean with a dry clothIDEAL SIZE: Dimensions: 20.47""L x 22.83""W x 23.23""H | Sits low to the ground for easy access | Features a large work surface | The perfect place for preschool kids and toddlers to develop their fine motor skills as they draw, paint and write",n/a,https://m.media-amazon.com/images/I/71TIReNLWXL._AC_UL320_.jpg,39.99,4.7,29648,"Delta Children MySize Chair Desk with Storage Bin, Grey",https://www.amazon.com/Delta-Children-MySize-Chair-Storage/dp/B07JQDF12D/ref=sr_1_234?dchild=1&keywords=chair&qid=1614191853&sr=8-234,20
B0046TR4IW,33.5 x 24.5 x 38.25,66,"#67,687 in Home & Kitchen #211 in Home Office Desk Chairs",HON Store,Amazon.com,"BREATHABLE MESH COMPUTER CHAIR: This work chair's contoured sandwich mesh seat back cushion with two layers of padding keep your body happy, supported and cool so you can concentrate on workBUDGET FRIENDLY: These task chairs offer excellence without expense so you can stretch your furniture dollar while working in comfort. Chair Seat : Seat Depth - Useable:18.0 Inch. Seat Overall Depth: 18.0 Inch. Seat Width: 20.0 InchERGONOMIC ADJUSTMENTS: Let this comfortable office chair take care of your body while you work with an easy, adjustable recline and pneumatic height adjustment. Center-tilt mechanism rotates the seat from a point at the center to comfortably reclineON THE MOVE: Pull up to your computer desk, swivel around to collaborate with your teammate, or wheel over to the snack area for a quick break with this five-star resin base and durable wheelsBASIC TROUBLE SHOOTING: Confirm that the cylinder is squarely mounted into the tilt mechanism, if not, remove and re-assemble. Confirm that the mechanism is mounted onto the seat pan in the proper orientation, if not, remove and re-assemble.",11-Oct-10,https://m.media-amazon.com/images/I/81IcOivaKfL._AC_UL320_.jpg,98.86,4.3,1377,"HON ValuTask Low Back Task Chair - Mesh Computer Chair for Office Desk, Black (HVL210)",https://www.amazon.com/HON-ValuTask-Back-Task-Chair/dp/B0046TR4IW/ref=sr_1_233?dchild=1&keywords=chair&qid=1614191853&sr=8-233,26
B00CGNXESE,n/a,2,"#40,985 in Home & Kitchen #144 in Home Office Desk Chairs",Laura Davidson Furniture Store,Laura Davidson Furniture,"#1 Rated mid century modern office chair from Laura Davidson. 400 pound weight limit.Heat embossed ribbing like the original - 3x more durable than cheaper stitched ribbed versions.Supportive chrome steel tube frame; ribbed leatherette seat with cast aluminum arms for comfort.5-star extra strength base with tilt-swivel mechanism, pneumatic gas seat-height adjustment, and tilt lock feature. Seat height ranges from 17 to 21 inches.Seat measures 20 inches wide by 20 inches deep with a 34 to 37 inch chair height; 2-year warranty.",19-Apr-13,https://m.media-amazon.com/images/I/61uJtEKSldL._AC_UL320_.jpg,249.99,4.6,94,SOHO Ribbed Management Office Chair (Black),https://www.amazon.com/SOHO-Ribbed-Management-Office-Black/dp/B00CGNXESE/ref=sr_1_231?dchild=1&keywords=chair&qid=1614191853&sr=8-231,30
B08KS26MC1,18 x 19 x 37,0,"#308,010 in Home & Kitchen #744 in Home Office Desk Chairs",HCB,HCB Store,"Extra ComfortOur mesh chairs use high-quality mesh material, full covered breathable backrest brings a more comfortable and fresh seating experience for you. Soft seat sponge cushion makes you feel no toil even working for all day long.Ergonomic DesignThese two pieces plastic triangle ornament lumbar support design is more ergonomic than normal office chair, added with adjustable seat height, makes it more suitable for different people's sitting posture and habits. Good choice for office, conference or working at home.Easy InstallationThis office chair is very easy to assemble, there are very detailed instruction which contains the steps to assemble and all the components and installation tools you might need, you don't need to prepare extra tools.BIFMAAll our chairs have passed the BIFMA test, equipped with certified five-claw base and nylon rolling swivel and casters, after hundreds of 360 degree rotation tests, it is still durable and smooth.After-Sale ServiceIf you have any problem with the installation or meet any question during the usage, please feel free to contact with our customer service, we promise we will provide you the most professioal technical support and best solution.",6-Oct-20,https://m.media-amazon.com/images/I/71YPK2rzOmL._AC_UL320_.jpg,39.99,4.2,39,HCB Office Chair Mesh Desk Chair Ergonomic Computer Chair with Lumbar Support Armrest Mid Back 360 Rolling Swivel Adjustable Height Meeting Chairs (Black),https://www.amazon.com/gp/slredirect/picassoRedirect.html/ref=pa_sp_atf_next_aps_sr_pg6_1?ie=UTF8&adId=A046204131VD5EAFBVIOX&url=%2FHCB-Ergonomic-Computer-Support-Adjustable%2Fdp%2FB08KS26MC1%2Fref%3Dsr_1_244_sspa%3Fdchild%3D1%26keywords%3Dchair%26qid%3D1614191856%26sr%3D8-244-spons%26psc%3D1&qualifier=1614191859&id=3931363447850595&widgetName=sp_atf_next,0
B08SLRTHMZ,28.7 x 27.6 x 53,0,"#412,472 in Home & Kitchen #185 in Computer Gaming Chairs",femor Store,airing,"Ergonomic Design: Upgraded high-density foam cotton headrest, lumbar pillow, thicker cushions and 3D support system can relieve neck and waist fatigue. The unique and innovative curved high back and bucket seats fit the body perfectly, and the highly breathable PU leather enhances comfort and provides you with the best gaming and work experience.Multi-functional and Upgraded Adjustable: 90-160 large degrees reclining function, removable headrest and lumbar cushion, retractable soft footrest, seat cushion and armrests with a maximum adjustable height of 4 inches and maximum rotation degree of the armrest is 70, 360 smooth-rolling swivel PU casters, provide the best body support and comprehensively upgrade flexibility and comfort.Sturdy and Durable Construction: Larger overall size: 28.7'' x 27.6''x 49''-53'' (L x W x H), backrest: 33'' x 22'' (H x W), cushion: 21.3 x 20.5 (W x D), using high-density foam cotton and waterproof PU leather, upgraded sturdy metal frame, international standard explosion-proof gas lift and 360swivel nylon base can bear 330 pounds of weight.Quick Assembly and Easy Cleaning: All necessary hardware and instructions are included. The estimated assembly time is 15 minutes. High-quality PU leather is easy to clean and fade resistant.Wide Application and After-Sales Service: It can be used as a good companion for adult work and kid learning, or an ideal gift for game enthusiasts. It can be used in offices and homes. It will be your ideal choice for playing computer games, watching TV, working, studying and relaxing. If you have any questions during the use of the product, you can contact us at any time. We will provide the most comprehensive and sincere service.",11-Jan-21,https://m.media-amazon.com/images/I/71A9RP+ahuL._AC_UL320_.jpg,135.99,5,6,femor Gaming Chair Home Office Chair with Footrest Ergonomic Adjustable Leather Computer Desk Chair Racing Swivel Recliner Large Size High Back Executive Task Chair with Headrest Lumbar Support (Blue),https://www.amazon.com/gp/slredirect/picassoRedirect.html/ref=pa_sp_atf_next_aps_sr_pg6_1?ie=UTF8&adId=A08988391Z2R5H427MOSN&url=%2Ffemor-Footrest-Ergonomic-Adjustable-Executive%2Fdp%2FB08SLRTHMZ%2Fref%3Dsr_1_242_sspa%3Fdchild%3D1%26keywords%3Dchair%26qid%3D1614191856%26sr%3D8-242-spons%26psc%3D1&qualifier=1614191859&id=3931363447850595&widgetName=sp_atf_next,41
B07H9ZT2TW,27.8 x 27.8 x 43.3,2,"#9,399 in Office Products #27 in Managerial Chairs & Executive Chairs",CLATINA Store,CLATINA Office Supply,"FULLY ADJUSTMENT DESIGN: you can adjust the seat height and depth, the armrest height and angle, the lumbar support height, the backrest tilt angles and tilt tension. All these designs aim to help you find a comfortable sitting position just for you.RELIABLE COMFORT: this super comfortable office chair features breathable back that allows airflow to keep your back cool. Besides, the updated thick pad with soft texture can obviously decline the pressure of the sedentary.ENHANCED FRAME: featuring reliable ergonomic support, this 360 degree swivel chair seat back reclines from 90 up to 135 degrees. Its gas lift has been tested and the solid construction can support up to 275 lbs.EASY TO INSTALL: simple instructions enable anyone to put this executive chair together in FIVE simple steps! Once chair is mounted, youll be able to adjust the chair to fit your individual needs.5-YEAR WARRANTY: Your 100% satisfaction is our #1 priority. We offer a 60-month warranty and free replace or return sevice within 90 days. Feel free to contact our CS if you have any qustions.",13-Sep-18,https://m.media-amazon.com/images/I/61LdwLROvqL._AC_UL320_.jpg,199.99,4.4,171,CLATINA Ergonomic High Swivel Executive Chair with Adjustable Height 3D Arm Rest Lumbar Support and Upholstered Back for Home Office Gray New Version,https://www.amazon.com/gp/slredirect/picassoRedirect.html/ref=pa_sp_atf_next_aps_sr_pg6_1?ie=UTF8&adId=A054030339UQ0YHG885BE&url=%2FCLATINA-Ergonomic-Executive-Adjustable-Upholstered%2Fdp%2FB07H9ZT2TW%2Fref%3Dsr_1_243_sspa%3Fdchild%3D1%26keywords%3Dchair%26qid%3D1614191856%26sr%3D8-243-spons%26psc%3D1%26smid%3DA3KJUR99JGR6ZG&qualifier=1614191859&id=3931363447850595&widgetName=sp_atf_next,60.5
B088ZGHSZ7,20.87 x 20.87 x 28.15,0,"#34,381 in Home & Kitchen #128 in Home Office Desk Chairs",YAHEETECH Store,Yaheetech,"Mesh & Leather Combination: The match of mesh and PU Leather is the highlighting of this chair. Two different materials bring different fine attributes. The leather covered seat cushion is easy to maintain and durable; The breathable mesh back also optimize the supporting feature.Comfortable: Soft seat padding reduces seating muscle fatigue. Breathable back mesh will keep you dry and cool all the time.Premium PU Leather : The seat is covered by high-quality PU leather, making the surface easy to clean, deformation resistant, wearproof with a soft and firm texture. Premium PU Leather coverage comes with both luxury and comfort, offering a feeling of the right sitting.Heavy-duty: Capable of up to 264.6lb with SGS-certified gas lift, quality plastic base and stable wheel casters. Great addition to home office computer workstation. Reliable for long-term use.360 Smooth Mobility: Rolling on 5 dual-wheel nylon casters will boost your productivity. No need to stand up, you can move smoothly from one task to another in this one chair without scratching the floor. These durable nylon casters can move effortlessly from any angles, they do not produce any noises and are built to last.",21-May-20,https://m.media-amazon.com/images/I/81Ki4rj8IVL._AC_UL320_.jpg,57.99,4.4,563,"Yaheetech Office Desk Chair Mesh Rolling Lumbar Support Computer Chair with Leather Padded Seat, Ergonomic Adjustable Task Chair Brown",https://www.amazon.com/Yaheetech-Rolling-Computer-Ergonomic-Adjustable/dp/B088ZGHSZ7/ref=sr_1_230?dchild=1&keywords=chair&qid=1614191853&sr=8-230,22
B08FWZBQWX,25.2 x 22.44 x 42.52,0,"#307,374 in Home & Kitchen #742 in Home Office Desk Chairs",Tribesigns Store,Tribesigns-Way to Origin,"Long Lasting Chair Base  Made of metal base with plastic shell, very sturdy and long lasting than the base made of non-woven, which will usually fall off after 1 yearUpgraded Thicken & Widen Seat Cushion  The office chair boasts 3.15thick and 19.29wide breathable seat cushion, made of 40D high density sponge that is firm and supportive for all-day comfort for a better workday, also fit the shape of most people, even for big and tall3D Armrest Design & Tilt  This big and tall office chair features full 3D PU armrest, can be adjusted up, down, back, forward, left and right. 3.93 Height adjusted and built in tilt tension to lean back easily, help you to find the most comfortable position for yourselfErgonomic Design This ergonomic office chair come with breathable mid back mesh promotes air circulation for a comfortable experience in any office, adjustable lumbar support, conform to your back for customized comfort, helps to alleviate pressure where neededEasy to Install  This desk chair is easy to put together, come with tools and instructions. We also provide install video in our product details. Comes with full 5-Year Manufacturing Warranty and Total Customer Service. So, why not take a look at your space now, and take this swivel mesh chair to home now",14-Aug-20,https://m.media-amazon.com/images/I/81SLI+KE2QL._AC_UL320_.jpg,139.99,3.7,24,"Ergonomic Office Chair, Big and Tall Home Office Desk Chair with 3D Armrest, Tribesigns Mid Back Mesh Computer Chair with Lumbar Support, Wide Seat and Rolling Swive for Women Men, Black",https://www.amazon.com/Ergonomic-Armrest-Tribesigns-Computer-Support/dp/B08FWZBQWX/ref=sr_1_228?dchild=1&keywords=chair&qid=1614191853&sr=8-228,32.7
B07SX24YVG,19.5 x 20.1 x 45.2,0,"#13,989 in Home & Kitchen #30 in Video Game Chairs",KaiMeng,n/a,"KaiMeng gaming chairs designed for teens, adults, providing a comfortable experience for your work, study or video game.Chair using upgraded SGS BIFMA gas lift, durable, reliable.Unique ergonomic design with high quality PU leather high back and padded armrests, comfortable touch, perfect for your life.5 star base with 360 mute swivel wheels, running smoothly and protecting your floor.Adjustable height 13.5"" to 16.5"", seat area: 19.5""L x 20.1""W, backrest height 26.93"". Maximum capacity280 LBS.",27-Mar-19,https://m.media-amazon.com/images/I/71C8CQ8xbtL._AC_UL320_.jpg,0,4.3,3514,"KaiMeng Office High Back Leather Computer Ergonomic Height Adjustable Racing Game Desk Executive Conference Task Chair, 19.5"" x 20.1"" x 44.2"", Red",https://www.amazon.com/Kaimeng-Ergonomic-Adjustable-Executive-Computer/dp/B07SX24YVG/ref=sr_1_229?dchild=1&keywords=chair&qid=1614191853&sr=8-229,28.7
