ASIN,Dimensions,activeseller,bestseller,brand,buybox,description,firstdate,img,price,rating,reviews,title,url,weight_lbs
B087CZZNDJ,16.9 x 23.2 x 35,0,"#41,612 in Home & Kitchen #146 in Home Office Desk Chairs",SIHOO Store,SIHOO,"RELIABLE COMFORTErgonomic curved mid back perfectly supports your body. 2.5thick cushion padded with high density shaping sponge that soft and comfortable for long time use. The lumbar support can be adjusted up and down which is powered to release your waist fatigue.The back can be reclined and locked from 90 to 120 degrees for a good working, gaming and relaxing .FOLDING ARMREST: Folding padded armrests are designed with human-oriented construction. It is made of high strength plastic, which is resistant to temperature and deformation. when you work, the armrest can lift down to support your armrest, and you can lift up for saving space when you relax. The lifting Angle is from 0to 90, which can be adjusted according to your need.HIGH QUALITY: Certified by BIFMA, High-quality and durable base, more solid and reliable. 360 degrees rotating casters, quiet and silent when moving, the casters will not scratch the floor. The mesh chair can bear the weight of 300lbs, which is a guarantee for your personal safety.EASY ASSEMBLY: The package is equipped with the tools and gloves required for installation, and comes with clear instruction to help you install quickly.WARRANTY: Product warranty period is one year. If there are any quality problems, please contact us. After confirming, we will provide a replacement part or product for you. SIHOO provides full parts coverage for the three years of the warranty period, at zero cost for you!",27-Apr-20,https://m.media-amazon.com/images/I/714X5CMZO9L._AC_UL320_.jpg,129.99,4.2,952,"SIHOO Mesh Office Chair, Office Desk Chair, Breathable Chair with Comfortable Lumbar Support, Liftable and Reversible Armrest, Nylon Silent CastersGrey",https://www.amazon.com/gp/slredirect/picassoRedirect.html/ref=pa_sp_btf_aps_sr_pg5_1?ie=UTF8&adId=A003671336EJDUXPC9NSC&url=%2FSIHOO-Breathable-Comfortable-Reversible-Casters%25EF%25BC%2588Grey%25EF%25BC%2589%2Fdp%2FB087CZZNDJ%2Fref%3Dsr_1_250_sspa%3Fdchild%3D1%26keywords%3Dchair%26qid%3D1614191853%26sr%3D8-250-spons%26psc%3D1&qualifier=1614191856&id=6931121283138064&widgetName=sp_btf,25.6
B088H586MG,26 x 25.1 x 12.8,2,"#350,415 in Home & Kitchen #667 in Living Room Chairs",Nost &amp; Host,Nost &amp; Host US,"Mid-century Modern StyleCrafted of classic gray fabric and dark brown solid wood legs, our storage accent chair provides a mid-century modern style for your home Multifunctional and StorageOur accent chair with storage is perfect to use as a foot rest stool, living room chair, dinning chair, vanity chair, lounge chair, study room chair. The accent chair chest is 7.75'' deep. You can store books, blankets, magazines, and idle items to keep your space neatComfortableThe armless accent chair is equipped with 3.5"" thick seat cushion and backrest. The high resilience sponge inside add superior comfort and the wide cushion lid provide you the ergonomic sitting posture Sturdy ConstructionConstructed of hardwood frame and solid wood legs with anti-slip pads, the slipper chair has great stability that can hold up to 300 LbsSuper Easy AssemblyHardware and accessories included, all you need just put the parts together and screw on. Product dimension: 22.25""L x 25""W x 31.5""H.",12-May-20,https://m.media-amazon.com/images/I/71rCXmNBY0L._AC_UL320_.jpg,129.99,4.8,24,"Nost &amp; Host Accent Chair with Storage Armless Tufted Removable Lid Slipper Padded Chair Seat with Upholstered Fabric and Solid Wood Legs, Contemporary Single Sofa Sitting Vanity Chair Classic Gray",https://www.amazon.com/Nost-Host-Removable-Upholstered-Contemporary/dp/B088H586MG/ref=sr_1_240?dchild=1&keywords=chair&qid=1614191853&sr=8-240,36
B0813XXC6C,23.4 x 22.6 x 32.3,2,"#274,675 in Home & Kitchen #685 in Home Office Desk Chairs",JJS,JJS Designs,"HIGHT QUALITY CONSTRUCTION This simple office chair uses high-density sponge cushion, high breathable nylon mesh, durable base, solid rolling casters ,and D100 Gas lift. You can feel the quality when sitting on it.EXTRA LARGE BASEUnlike other chairs on the market, JJS uses a much larger star base to ensure its customers maximum comfort and safety. You will never tilt over on this trusty companion.ADDITIONAL PADDINGIn this model, we added extra thick cushion to support you for a long period of time. Say Goodbye to all your pain after seating for hours.ERGONOMIC SWIVEL CHAIR Pneumatic seat height adjustment and 360-degree swivel allows you to customize your comfort. Feeling lazy? Our quiet and sturdy rolling casters make sure you can go grab some snacks without leaving your seat.",7-Nov-19,https://m.media-amazon.com/images/I/61JT8ll60iL._AC_UL320_.jpg,79.99,4.5,163,"Home Office Low Back Computer Executive Chair by JJS, Ergonomic Mesh Chair with Extra Large Base and Pads, Black/Blue",https://www.amazon.com/gp/slredirect/picassoRedirect.html/ref=pa_sp_btf_aps_sr_pg5_1?ie=UTF8&adId=A07195932CTFJ7LKBVKW2&url=%2FOffice-Computer-Executive-JJS-Ergonomic%2Fdp%2FB0813XXC6C%2Fref%3Dsr_1_249_sspa%3Fdchild%3D1%26keywords%3Dchair%26qid%3D1614191853%26sr%3D8-249-spons%26psc%3D1&qualifier=1614191856&id=6931121283138064&widgetName=sp_btf,16.3
B08C9LTK5P,21.65 x 20.08 x 9.45,2,"#41,067 in Office Products #45 in Office Drafting Chairs",Captiva Designs,PHI VILLA,"Modern and SimpleOur drafting chair is designed with a modern detachable backrest for optimal support that features a well-padded artificial leather seat , adjustable height. It's a versatile stool that will suit almost any room,such as,studio, office, classroom, hair salon, and home.Hight Quality & Durable 3-inch thick seat top is filled with thicker memory foam meterial which has high resilience, welded foot-ring for increasing comfort and stability. Seat diameter 16.14"", leg base width 11.8"", maximum weight capacity: 300 lbs.Easy assembly drafting chairs, any adult can install in 5 minutes.Adjustable Heightit is convenient to adjust the seat height easily by pull up or down the handle besides seat, this drafting chair has a larger range of adjustable height : 25.5"" to 35.8"", about 8 inches taller than regular drafting chairs, it can be adapted to many desingers,office workers .Perfect 360swivel At the base of its sleek chrome-finished frame are 5 dual-stylish wheels which can roll any direction smoothly without making noise. An improvement on this cute drafting chair makes our modern functional chair delivers exceptional functionality and lasting value.Satisfaction GuaranteedWe provides you with professional customer service both before and after your purchase. Please feel free to contact us, we will solve your problem within 24 hours, you can rest assured that your investment will be protected",3-Jul-20,https://m.media-amazon.com/images/I/61up+6pM07L._AC_UL320_.jpg,99.99,3.9,24,"Captiva Designs Office Drafting Chair - Office Chair with Foot Ring for Rest,Adjustable Height Tall Drafting Chair for Women and Men Designer,Simple and Modern,Max Load Bearing up to 300 lbs,Black",https://www.amazon.com/Captiva-Designs-Office-Drafting-Chair/dp/B08C9LTK5P/ref=sr_1_241?dchild=1&keywords=chair&qid=1614191853&sr=8-241,20.2
B0047BA8VY,23.5 x 24.25 x 31.25,24,"#15,342 in Office Products #3 in Stacking Chairs",Flash Furniture Store,ForgioneRetailerInc,"Quality seating doesn't have to be expensive, but the benefits it provides are priceless. If you want to make everyone comfortable this padded stack chair is an excellent choice for your home or businessChair stacks up to 12 high making it ideal as a spare seating option, create row seating with the included ganging bracketSilver vein powder coated frame finish, 18 gauge steel frame holds up to 1000 lb. weight capacityContemporary style Big & Tall stacking chair for worship center, reception, office or home usePRODUCT MEASUREMENTS >>> Overall Size: 24.25""W x 23.5""D x 31.25""H | Seat Size: 20""W x 17""D x 18""H | Back Size: 22""W x 14.25""H",26-Jul-05,https://m.media-amazon.com/images/I/91cWxi4UmQL._AC_UL320_.jpg,68.45,4.5,629,"Flash Furniture Black Fabric Stack Chair, 1 Pack",https://www.amazon.com/Flash-Furniture-HERCULES-Rated-Fabric/dp/B0047BA8VY/ref=sr_1_239?dchild=1&keywords=chair&qid=1614191853&sr=8-239,21
B01M0LG5GC,29 x 28 x 44.75,41,"#4,289 in Office Products #7 in Managerial Chairs & Executive Chairs",OFM Store,Amazon.com,"PREMIUM MAKE & MATERIALS - The chair provides superior luxury and comfort even during long, intense work hours. The premium heat pressed diamond pattern provides a sophisticated detail that provides additional comfort.CONTOURED COMFORT - The computer chair features contoured, segmented ultra-plush padding, is covered in breathable SofThread leather for a luxurious feel, and provides all-day back support with the integrated lumbar cushion.INTEGRATED SUPPORT - This executive chair features an integrated headrest and arms that are padded for all-day comfort and support with a five-star base that is molded from reinforced resin with a 360-degree swivel.ERGONOMIC FEATURES - The center-tilt mechanism rotates the chair seat and back together into a comfortable reclining position while the tilt tension controls the rate and ease of recline, ensuring that you don't recline too fast.RELAX, WE'VE GOT YOUR BACK - This multi-purpose chair features a 250 lb weight capacity and is backed by the OFM Limited Lifetime Warranty. You can purchase this office chair with confidence.",27-Sep-16,https://m.media-amazon.com/images/I/81JhE8Aq68L._AC_UL320_.jpg,140.1,4.4,2523,"OFM ESS Collection Racing Style SofThread Leather High Back Office Chair, in Black (ESS-6060)",https://www.amazon.com/Essentials-High-Back-Executive-Chair-Leather/dp/B01M0LG5GC/ref=sr_1_238?dchild=1&keywords=chair&qid=1614191853&sr=8-238,1
B07Y568C75,30.5 x 25.5 x 16.5,2,"#200,400 in Office Products #515 in Managerial Chairs & Executive Chairs",CLATINA Store,CLATINA Office Supply,"WHAT YOU NEED: If you're looking to transform your daily sitting routine into a comfortable experience, or you're having problems with back pain due to hours of incorrect posture, we offer the perfect solution!PREMIUM QUALITY: The modern office chair is made from a sturdy metallic frame and breathable mesh, while the armrests contain high quality PU, an excellent and comfortable choice!COMFORTABLE AND ERGONOMIC: This eco-friendly chair has the role of preventing back pain caused by sedentary sitting. The curved back support help relieve lumbar pain and improves posture!FULLY ADJUSTABLE: The executive chair allows for full adjustment of your seat height depending on your needs. You can recline the back seat for lumbar support, while the smooth running castors are fully mobile.ELEGANT DESIGN: Add a touch of elegance to your home or office desk with this classic design mesh office chair! The black colour is easy to match with any sort of dcor, from minimalist to more traditional ones.",20-Sep-19,https://m.media-amazon.com/images/I/61lqPSlReGL._AC_UL320_.jpg,229.99,4.4,28,CLATINA Ergonomic High Mesh Swivel Executive Chair with Adjustable Height Arm Rest and Lumbar Support Back for Home Office,https://www.amazon.com/gp/slredirect/picassoRedirect.html/ref=pa_sp_atf_next_aps_sr_pg6_1?ie=UTF8&adId=A02637351WPXZFGBICP0Y&url=%2FCLATINA-Ergonomic-Executive-Adjustable-Certified%2Fdp%2FB07Y568C75%2Fref%3Dsr_1_241_sspa%3Fdchild%3D1%26keywords%3Dchair%26qid%3D1614191856%26sr%3D8-241-spons%26psc%3D1%26smid%3DA3KJUR99JGR6ZG&qualifier=1614191859&id=3931363447850595&widgetName=sp_atf_next,59.1
B07FY9FD4S,18.7 x 19.7 x 37,7,"#185,703 in Home & Kitchen #472 in Home Office Desk Chairs",VECELO Store,Amazon.com,Comfortable mesh chair for task / desk / school workErgonomic padded cushion seat for long-lasting comfortBreathable mesh back; dual-wheel casters for free rolling285 pound max weight capacity; adjustable seat-heightChair overall dimension: 18.7*19.7*37-40.5 in,26-Jul-18,https://m.media-amazon.com/images/I/71HhRCmtduL._AC_UL320_.jpg,69.99,4.1,677,"VECELO Premium Mesh Chair With 3D Surround Padded Seat Cushion For Task/Desk/Home Office Work, Black",https://www.amazon.com/VECELO-Premium-Chair-Surround-Cushion/dp/B07FY9FD4S/ref=sr_1_295?dchild=1&keywords=chair&qid=1614191856&sr=8-295,30.3
B074SZ9VPR,21.5 x 17.25 x 34,3,"#208,670 in Home & Kitchen #221 in Kitchen & Dining Room Chairs",EdgeMod,Amazon.com,Durable Fabric Material. Wood look Metal LegsSlightly curved back. Mid back heightAvailable in multiple colorsFloor protectorsSimple assembly,14-Aug-17,https://m.media-amazon.com/images/I/A1TZtguqKdL._AC_UL320_.jpg,167.33,4.6,302,"EDGEMOD Wadsworth Dining Chair with Walnut Legs, Set of 4, Gray",https://www.amazon.com/POLY-BARK-EM-287-GRY-X4-Wadsworth-Dining/dp/B074SZ9VPR/ref=sr_1_294?dchild=1&keywords=chair&qid=1614191856&sr=8-294,11.5
B08P5MT4DP,n/a,0,"#23,394 in Office Products #27 in Office Drafting Chairs",Devoko Store,devokowholesale,"-Ergonomic Design: Ergonomic lumbar support with breathable mesh material protects your waist and fabric seat with elastic foam provide you extra comfort sedentary not tired during long time working or playing.-Durable & Sturdy: Certified by BIFMA, this drafting chair is safe and reliable. 360 degree swivel lockable casters ensure effortless gliding over carpeted offices.-Simple Installation: Easy installation steps make you effortless. You can build it up only about 15 minutes following the pack instruction.-Adjustment and rollingThe chair can rotate freely 360 degrees, the height can be adjusted up and down , and the rocking can be adjusted. The wheels of the chair are silent wheels, which can roll silently 360 degrees.-What We Offer: A new office chair, Complete installation tools, An installation instruction. If you have any questions about products please contact us by Amazon message, we are glad to answer your queries ASAP.",26-Nov-20,https://m.media-amazon.com/images/I/61-MpnEtuWL._AC_UL320_.jpg,99.99,5,3,Devoko Drafting Chair Tall Office Chair with Flip-up Armrests Office Desk Chair Ergonomic Mesh Chair Lumbar Support with Adjustable Height (Black),https://www.amazon.com/Devoko-Drafting-Armrests-Ergonomic-Adjustable/dp/B08P5MT4DP/ref=sr_1_291?dchild=1&keywords=chair&qid=1614191856&sr=8-291,0
B07PBL77JT,11.5 x 13.25 x 21,10,"#119,693 in Home & Kitchen #33 in Folding Chairs#542 in Kids' Furniture",Flash Furniture Store,Amazon.com,"Upholstery, Polyester, CottonBe proactive and ensure your gathering goes smoothly by providing children's seating. Creating a kids' zone gives them a home base to hang out with cousins and friends and be a little messy without disrupting other guests so everyone has a great timeCommercial grade kids folding chair with waterproof vinyl padded detachable seat, lightweight portable design for quick setup and breakdownUV stabilized polypropylene resin, aluminum hardware, durable frame holds up to 264 lb. weight capacityContemporary style child size event folding chair for rental business, banquet hall, restaurant, patio or dining roomPRODUCT MEASUREMENTS >>> Overall Size: 13.25""W x 11.5""D x 21""H | Seat Size: 11.75""W x 9.5""D x 12.5""H | Back Size: 12""W x 9.75""H | Folded Size: 13.25""W x 1.5""D x 24""H",n/a,https://m.media-amazon.com/images/I/71QdVOet+mL._AC_UL320_.jpg,53.99,4.5,131,Flash Furniture Kids Folding Chairs with Padded Seats | Set of 2 White Resin Folding Chair with Vinyl Padded Seat for Kids,https://www.amazon.com/Flash-Furniture-Folding-Chairs-Padded/dp/B07PBL77JT/ref=sr_1_293?dchild=1&keywords=chair&qid=1614191856&sr=8-293,13
B01N3PMZRN,n/a,10,"#63,636 in Home & Kitchen #66 in Living Room Chairs",Mainstay,Mendoza's Financial Services,"Soft, wide seat Foldable steel frame Cool faux-fur fabric Weight capacity: 225 lbs",16-Jul-16,https://m.media-amazon.com/images/I/61C2WF8XGPL._AC_UL320_.jpg,60.23,4,227,Very Comfortable Mainstays Faux-Fur Saucer Chair (Black),https://www.amazon.com/Comfortable-Mainstays-Faux-Fur-Saucer-Chair/dp/B01N3PMZRN/ref=sr_1_292?dchild=1&keywords=chair&qid=1614191856&sr=8-292,0
B015ETI5WQ,20 x 21 x 33,11,"#116,672 in Home & Kitchen #330 in Home Office Desk Chairs",Armen Living Store,Amazon.com,"Mid-century modern and contemporary but can blend into any design providing an inviting centerpiece for your guestsChrome and solid walnut wood finish for durability and longevityFull 360 swivel and adjustable heightGreat for office , living room, task or desk chair or even in a commercial settingMedium high cushioned open back to help keep your back supported and alignedThick semi firm cushion for all day comfortEames inspired design with walnut back shell and seatWeight capacity: 250 lbs",15-Sep-15,https://m.media-amazon.com/images/I/91hLa6G-8JL._AC_UL320_.jpg,117.08,4.5,352,Armen Living Daphne Office Chair in Black Faux Leather and Chrome Finish,https://www.amazon.com/Armen-Living-LCDAOFCHBL-Daphne-Leather/dp/B015ETI5WQ/ref=sr_1_290?dchild=1&keywords=chair&qid=1614191856&sr=8-290,22
B08HKXPLKF,n/a,0,"#75,978 in Home & Kitchen #45 in Computer Gaming Chairs",OHAHO Store,OHAHO,"Ergonomic body design makes it an ideal seat of choice for gaming, working and studying.With bright RGB lighting around, simply plug the cable into USB port and instantly create an extremely cool atmosphere.Quality Material Premium PU leather (skin-friendly and clean easily), high-density thicker sponge (high resilience and more comfortable), Mute PU wheel (protect the wooden floors from being scratched).Multi-function 90-180 degree adjustable backrest, Seat-height and armrest adjustable,360 swivel round base, Tilt lock function, removable headrest pillow and lumbar cushionExcellent after sales Service Free replacement or money back for any reason within 30 days. Free replacement for damaged or defective parts within 12 months. Any dissatisfaction with our products or service, please contact us to solve",6-Sep-20,https://m.media-amazon.com/images/I/61LYSXjENnL._AC_UL320_.jpg,179.99,4.5,83,OHAHO Gaming Chair RGB Lighting High Back Computer Chair PU Leather Desk Chair PC Racing LED Ergonomic Adjustable Swivel Task Chair with Headrest and Lumbar Support (Black),https://www.amazon.com/gp/slredirect/picassoRedirect.html/ref=pa_sp_btf_aps_sr_pg6_1?ie=UTF8&adId=A06927271OAUPK2LITVTO&url=%2FOHAHO-Lighting-Computer-Ergonomic-Adjustable%2Fdp%2FB08HKXPLKF%2Fref%3Dsr_1_297_sspa%3Fdchild%3D1%26keywords%3Dchair%26qid%3D1614191856%26sr%3D8-297-spons%26psc%3D1&qualifier=1614191859&id=3931363447850595&widgetName=sp_btf,0
B01LWNLIC7,n/a,27,"#27,638 in Home & Kitchen  #20 in Living Room Chairs",OFM Store,Amazon.com,"COOLING MESH BACK WORK CHAIR: Sink into comfort with the breathable mesh back and seat that conforms to your bodyMODERN OFFICE CHAIR: The clean design fits well in any office space while the sturdy black steel tube frame holds up to heavy useSTACKING CHAIRS: The multi-purpose molded chairs add comfort, while the stacking feature provides convenience to any small spaceCHAIR WITH ARMS: Integrated sturdy steal arms provide added upper body supportDURABLE OFFICE FURNITURE: The chairs' superior construction allows for a weight capacity of up to 250lbs and is backed by the Essentials by OFM limited lifetime warranty",18-Jun-11,https://m.media-amazon.com/images/I/71Y4FBsc0sL._AC_UL320_.jpg,52.99,4.4,764,"OFM ESS Collection Mesh Back Upholstered Side Chair, with Arms, Black",https://www.amazon.com/gp/slredirect/picassoRedirect.html/ref=pa_sp_btf_aps_sr_pg6_1?ie=UTF8&adId=A1003044EJ0725FZJRQ8&url=%2FEssentials-Upholstered-Stacking-Guest-Reception%2Fdp%2FB01LWNLIC7%2Fref%3Dsr_1_296_sspa%3Fdchild%3D1%26keywords%3Dchair%26qid%3D1614191856%26sr%3D8-296-spons%26psc%3D1&qualifier=1614191859&id=3931363447850595&widgetName=sp_btf,0
B08PYQY8ZG,21.46 x 22.44 x 28.94,0,"#164,258 in Home & Kitchen #171 in Kitchen & Dining Room Chairs",YAHEETECH Store,Yaheetech,"[METAL FRAME CHAIR]: It is the metal frame that makes these chairs stable and durable. The sturdy construction and metal material ensure the chairs will serve well for a long time.[WITH ARMREST & BACKREST]: The armrest and backrest are in one piece with a suitablecurve. It makes you feel comfortable when you sit and lean back. The Y-shaped cutout makes the chair attractive and unique, also improving the stability of the backrest.[NICE HOME DECOR]: These modern weave chairs are sold in a set of 2, suitable for use in different places, such as dining rooms, living rooms, workrooms, parties, banquets, etc. You can freely match with a tea table or desk as you wish.[MODERN DESIGN]: The clean lines and simple color, this pair of chairs are a good combination of aesthetics and stability. The chair legs have screw-in protective feet, helping keep chairs stable and meeting the uneven floor.[DETAILED MANUAL]: All matching accessories and the detailed instructions are accompanying the products. You might put them together without too much effort. If you have any problems and questions, please contact us for further assistance.",8-Dec-20,https://m.media-amazon.com/images/I/81dnno++wLL._AC_UL320_.jpg,142.99,4.3,5,"Yaheetech Weave Arm Chair Y-Shaped Backrest Mid-Century Metal Dining Chair Hemp Seat Set of 2, Wood Color",https://www.amazon.com/Yaheetech-Y-Shaped-Backrest-Mid-Century-Dining/dp/B08PYQY8ZG/ref=sr_1_288?dchild=1&keywords=chair&qid=1614191856&sr=8-288,27.3
B07NGSNYPF,n/a,0,"#41,244 in Home & Kitchen #18 in Kitchen & Dining Room Chairs",Lansen Furniture,Lansen Furniture,"Modern design accent armchair, elegantly curved silhouette provides maximum comfort, is perfect for decor your living room bedroom dining room officeFrame constructions have been rigorously tested to simulate the home and transportation environments for improved durability.Solid wood legs come in a natural finish. Corners are glued, blocked and stapled. High-quality plush high-density foam cushioning is upholsteredDimensions of Chair: 23""W X 24""D X 29.1""H, Seat: 18""W X 17.5""D X 19""H, Back 18""H, Top of chair back 16.5""W.1-year limited warranty. Assembly instructions included.",18-Aug-18,https://m.media-amazon.com/images/I/71dZcTlNZpL._AC_UL320_.jpg,99.9,4.5,1290,Lansen Furniture (Set of 1) Modern Living Dining Room Accent Arm Chairs Club Guest with Solid Wood Legs (Yellow),https://www.amazon.com/Lansen-Furniture-Modern-Living-Dining/dp/B07NGSNYPF/ref=sr_1_289?dchild=1&keywords=chair&qid=1614191856&sr=8-289,0
B0811FGP9C,22.83 x 22.44 x 39.17,0,"#255,282 in Home & Kitchen #640 in Home Office Desk Chairs",Rimiking Store,Amazon.com,"Ergonomic Design: The excellent design of the ergonomic backrest and the padded seat can relieve leg pressure that offers you a pleasure sitting position. The back and seat cushion are back-tilt synchronously, the comfortable spine curve is fixed, and the back is always protected. Secure armrests allow you to fully relax your arms when working for a long time.Adjustments: Simple pneumatic controls let you raise or lower your seat and rock back in your chair. Pulling out on the control handle, allows your chair to recline back, or sit forward and push the control handle in to tilt upright.Swivel Casters: The chair can swivel 360 degrees. The casters are suitable for hard floors, carpet floors and more, swivel without noise and won't scratch the floor. The 5 legs and nylon smooth-rolling casters make the chair more stable and safe. Maximum capacity of up to 250 lbs.Assemble Easily: We provide all the tools and the detailed specification for you. No additional tools needed for assembly. For your convenience, all screws have extra backups. It is easy to assemble this executive chair by yourself at home.Rest Assured Purchase: We have a professional customer service team, so if you have any questions, please do not hesitate to contact us.",5-Nov-19,https://m.media-amazon.com/images/I/61uQs02Q9hL._AC_UL320_.jpg,78.03,4.8,18,"Rimiking Ergonomic Executive Office Chair Task Chair Swivel Office Chair Comfortable Bonded Leather Desk Chair Computer Chair Home Office Chair with Wheels and Arms, White",https://www.amazon.com/Office-Ergonomic-Adjustable-Headrest-Computer/dp/B0811FGP9C/ref=sr_1_287?dchild=1&keywords=chair&qid=1614191856&sr=8-287,23.2
B07XX42BBC,30 x 24 x 15,3,"#61,265 in Home & Kitchen #91 in Video Game Chairs",JUMMICO Store,SimonDreamer,"Selected material: High-quality smooth leather covers the backrest and cushion with thick padding provides extra comfort during your gaming timeFunction: You can rock back and forth by adjusting the knob to get better relaxation at work; Ergonomically curved back can perfectly support your spineComfortable design: Large and wide backrest and seat cushion help promote a comfortable seated position and provide a better experience when you enjoy intense gaming timeMaximum load capacity: 300lbs; Seat Size: 19"" X 19.5""(LXW), Back Size: 26.6"" X 19.5""(WXH); Adjustable height range: 15.2""-18.2""Good service: If you have any questions, please contact us freely, we are glad to help you solve it",4-Jul-19,https://m.media-amazon.com/images/I/71SWGSjOcDL._AC_UL320_.jpg,74.99,4.2,3247,JUMMICO Gaming Chair Ergonomic Executive Office Desk Chair High Back Leather Swivel Computer Racing Chair with Lumbar Support (White),https://www.amazon.com/JUMMICO-Ergonomic-Executive-Leather-Computer/dp/B07XX42BBC/ref=sr_1_308?dchild=1&keywords=chair&qid=1614191859&sr=8-308,0
